<?xml version="1.0" encoding="UTF-8"?>
<getNHSNumberRequest-v1-0 xmlns="urn:hl7-org:v3" xmlns:xsi="http://www.w3.org/2001/XMLSchema-instance" xsi:schemaLocation="urn:hl7-org:v3 ../../Schemas/QUPA_MT000002GB01.xsd" moodCode="EVN" classCode="CACT">
	<id root="3E25ACE2-23F8-4A37-B446-6A37F31BF77C"/>
	<code codeSystem="2.16.840.1.113883.2.1.3.2.4.17.284" code="getNHSNumberRequest-v1-0"/>
	<queryEvent>
		<Person.DateOfBirth>
			<value value="19890101"/>
			<semanticsText>Person.DateOfBirth</semanticsText>
		</Person.DateOfBirth>
		<Person.Gender>
			<value code="1" codeSystem="2.16.840.1.113883.2.1.3.2.4.16.25"/>
			<semanticsText>Person.Gender</semanticsText>
		</Person.Gender>
		<Person.Name>
			<value>
				<given>John</given>
				<family>Smith</family>
			</value>
			<semanticsText>Person.Name</semanticsText>
		</Person.Name>
	</queryEvent>
</getNHSNumberRequest-v1-0>
